{
  "$schema": "../schemas/feature-parity.schema.json",
  "schemaVersion": 1,
  "feature": "reopen-tool-rows",
  "summary": "Reopening a chat (switch away and back, app restart, phone or Android thread open) keeps a finished turn's tool row and its changed-file cards. Both were built live in the renderer and never stored, the SQLite mirror held only assistant text, and the Codex transcript parser reads messages only, so a reload lost every changed-file card and, outside Claude, every tool row. The backend now mirrors both at turn end, the reload merge folds a mirrored tool call into Claude's transcript copy, a card's accept/reject is stored, and reverting a card is refused once its file has changed since the diff.",
  "surfaces": {
    "desktop": {
      "status": "implemented",
      "evidence": [
        "src/renderer/components/chat/ChatPanel.tsx",
        "src/renderer/components/chat/provider-event-reducer.ts",
        "src/preload/index.ts",
        "src/main/provider/adapters/demo-adapter.ts",
        "e2e/reopen-tool-rows.e2e.mjs"
      ]
    },
    "reactNativeIos": {
      "status": "implemented",
      "evidence": [
        "apps/mobile/src/lib/thread-history.ts",
        "tests/unit/mobile-thread-history.test.ts"
      ]
    },
    "nativeAndroid": {
      "status": "implemented",
      "evidence": [
        "apps/android/app/src/main/java/app/switchboard/mobile/domain/remote/RemoteModels.kt",
        "apps/android/app/src/main/java/app/switchboard/mobile/domain/remote/RemoteDecoders.kt",
        "apps/android/app/src/main/java/app/switchboard/mobile/data/thread/ThreadSessionCoordinator.kt",
        "apps/android/app/src/test/java/app/switchboard/mobile/data/thread/LoadedSessionSnapshotMapperTest.kt",
        "apps/android/app/src/test/java/app/switchboard/mobile/domain/remote/RemoteHistoryDecoderTest.kt"
      ]
    },
    "sharedBackendApi": {
      "status": "implemented",
      "evidence": [
        "src/shared/turn-activity.ts",
        "src/shared/ipc-channels.ts",
        "src/main/provider/provider-registry.ts",
        "src/main/provider/checkpoint-tracker.ts",
        "src/main/notebooks/manager.ts",
        "src/main/agent/dedupe-messages.ts",
        "src/main/ipc/app.ts",
        "src/main/ipc/files.ts",
        "src/main/files/writing.ts",
        "tests/unit/assistant-mirror.test.ts",
        "tests/unit/reopen-tool-rows.test.ts",
        "tests/unit/checkpoint-tracker.test.ts",
        "tests/unit/files-write.test.ts",
        "tests/unit/provider-event-reducer.test.ts"
      ]
    },
    "storageDataMigration": {
      "status": "implemented",
      "evidence": [
        "src/main/db/messages.ts",
        "tests/fixtures/reopen-tool-rows/claude-session.jsonl",
        "tests/fixtures/reopen-tool-rows/codex-rollout.jsonl"
      ]
    },
    "updateRelease": {
      "status": "not_applicable",
      "reason": "No migration: the card is stored as { fileDiff } in the existing messages.attachments_json column, where a fork already copies it, and tool rows use the existing tool_calls column. An older build reads the new rows as empty assistant rows it skips. load-by-id only gains optional fileDiff and more toolCalls rows, which older phones and Android builds skip or already render. files:write-file and files:delete-file gain an optional trailing argument an older backend ignores. The phone change is JS-only and ships over OTA; Android ships in its next APK and until then shows mirrored tool rows but not changed-file rows from history."
    }
  },
  "verification": {
    "automated": [
      "e2e/reopen-tool-rows.e2e.mjs (demo adapter, a real edit in a git repo) failed on the unfixed build: with a Claude-shaped transcript the reopened turn showed 'Used 1 tool' without 'Changed 1 file', and with SQLite as the only history it showed neither, after both a switch away and back and a restart. It passes all twelve checks with the fix: 'Used 1 tool' (not 2) shows the mirror and the transcript copy fold into one row, Reject on a reopened card is refused after a later hand edit and leaves the file alone, goes through while the file still holds the agent's change, and the card still reads '↩ reverted' after another restart.",
      "tests/unit/reopen-tool-rows.test.ts parses redacted copies of a real Claude session JSONL and a real Codex rollout file, merges them with the rows the registry mirrors, and asserts the rendered turn: text, tools, text, files. Two of its cases fail against the old merge (a mirrored tool row was paired with an unrelated empty-content transcript row and dropped).",
      "tests/unit/assistant-mirror.test.ts pins the tool and changed-file mirroring: start time, capped input and output, one row for a re-announced call, cards stamped with the turn end even when the diff finishes later, oversized cards skipped. tests/unit/checkpoint-tracker.test.ts pins that a second launch does not reuse a fileEditId.",
      "tests/unit/files-write.test.ts pins the write-back guard: a revert or delete goes through only while the file still holds what the agent wrote (line endings ignored), and an already absent file is still a successful delete. tests/unit/reopen-tool-rows.test.ts also pins that a history window counts only messages with text and caps the tool and changed-file text it carries (8M chars), dropping the oldest activity rows first and never text.",
      "e2e/chat-render-order.e2e.mjs still passes, so #117's ordering holds."
    ],
    "hardware": [
      "Read-only survey of real transcripts on the developer's Mac: Claude Code JSONL writes one content block per line and its tool_use id is the id the Claude adapter streams as toolId, so the merge can match on it. Codex rollouts record tool calls as custom_tool_call / function_call items, which the Codex parser skips."
    ],
    "notExercised": [
      "No live Claude, Codex or OpenCode turn was run end to end; the reproduction uses the demo adapter and redacted real transcript shapes.",
      "The phone and native Android were not run. The Android unit tests were not run locally (no JDK on this machine); android-native-ci runs them on the pull request.",
      "Deferred: turns from before this fix are not backfilled. Claude chats keep their transcript tool rows (still without outputs); Codex and OpenCode tool rows and every changed-file card from those turns stay lost. Parsing Codex's own tool-call items was left out because their ids have not been confirmed to match the app-server item ids the live stream uses, and a mismatch would show each call twice.",
      "The per-turn duration on the 'Used N tools' row is not stored, so it is absent after a reload. Pre-existing and unchanged.",
      "Deferred: the phone and Android show a changed-file row from history without its accept/reject status (their live rows never had one either), so a card rejected on desktop still reads as applied there. Needs a status field on both feed items.",
      "Deferred: a tool.completed that arrives after its turn.completed (an interrupt, or a Codex item finishing after the turn) is not mirrored, so that row reloads without its output."
    ]
  }
}
