{
  "$schema": "../schemas/feature-parity.schema.json",
  "schemaVersion": 1,
  "feature": "synthetic-user-messages",
  "summary": "Render provider-generated user-role transcript entries (Claude task notifications, interrupts, local-command output, Codex bootstraps) as compact system rows instead of raw-XML 'You' bubbles, on every surface.",
  "surfaces": {
    "desktop": {
      "status": "implemented",
      "evidence": [
        "src/renderer/components/chat/SyntheticUserRow.tsx",
        "src/renderer/components/chat/MessageBubble.tsx",
        "src/renderer/components/chat/MessageList.tsx",
        "src/renderer/services/sessionPreview.ts",
        "src/renderer/services/desktopTurnSubmission.ts"
      ]
    },
    "reactNativeIos": {
      "status": "implemented",
      "evidence": [
        "apps/mobile/src/components/SyntheticRow.tsx",
        "apps/mobile/src/components/__tests__/SyntheticRow.test.tsx",
        "apps/mobile/src/lib/threadHistory.ts",
        "apps/mobile/src/stores/chat.ts",
        "apps/mobile/src/screens/ThreadScreen.tsx",
        "tests/unit/mobile-thread-history.test.ts"
      ]
    },
    "nativeAndroid": {
      "status": "implemented",
      "evidence": [
        "apps/android/app/src/main/java/app/switchboard/mobile/domain/thread/SyntheticUserMessage.kt",
        "apps/android/app/src/main/java/app/switchboard/mobile/domain/thread/ThreadModels.kt",
        "apps/android/app/src/main/java/app/switchboard/mobile/ui/thread/ThreadPresentation.kt",
        "apps/android/app/src/main/java/app/switchboard/mobile/ui/thread/ThreadScreen.kt",
        "apps/android/app/src/test/java/app/switchboard/mobile/domain/thread/SyntheticUserMessageTest.kt",
        "apps/android/app/src/main/java/app/switchboard/mobile/data/thread/ThreadSessionCoordinator.kt",
        "apps/android/app/src/main/java/app/switchboard/mobile/data/thread/ThreadSnapshotStore.kt",
        "apps/android/app/src/main/java/app/switchboard/mobile/data/thread/CachedThreadStateMapper.kt",
        "apps/android/app/src/test/java/app/switchboard/mobile/data/thread/LoadedSessionSnapshotMapperTest.kt",
        "apps/android/app/src/main/java/app/switchboard/mobile/data/thread/ThreadStoreReducer.kt"
      ]
    },
    "sharedBackendApi": {
      "status": "implemented",
      "evidence": [
        "src/shared/synthetic-message.ts",
        "src/shared/provider-events.ts",
        "src/main/agent/jsonl-parser.ts",
        "src/main/projects/session-scanner.ts",
        "tests/unit/synthetic-message.test.ts",
        "tests/unit/jsonl-parser.test.ts"
      ]
    },
    "storageDataMigration": {
      "status": "implemented",
      "evidence": [
        "apps/mobile/src/stores/chat.ts",
        "apps/mobile/src/lib/threadHistory.ts",
        "apps/android/app/src/main/java/app/switchboard/mobile/data/thread/CachedThreadStateMapper.kt",
        "tests/unit/mobile-thread-history.test.ts"
      ]
    },
    "updateRelease": {
      "status": "implemented",
      "evidence": [
        "CHANGELOG.md"
      ]
    }
  },
  "verification": {
    "automated": [
      "tests/unit/synthetic-message.test.ts covers the shared parser with redacted real Claude samples: failed and completed notifications, a notification followed by typed text, the SYSTEM NOTIFICATION preamble, interrupts, local-command output, context-only blocks, and real messages that mention a marker.",
      "tests/unit/jsonl-parser.test.ts pins that isMeta user entries are dropped on reload, that a task notification survives to the renderer, and that Codex <image> wrapper blocks are stripped.",
      "tests/unit/mobile-thread-history.test.ts pins that phone history maps a notification to its own row and keeps the typed remainder as a user bubble.",
      "apps/mobile jest: SyntheticRow renders the label, never the XML, and shows ids on tap.",
      "apps/android JUnit: SyntheticUserMessageTest covers the Kotlin port and that ThreadPresenter.rows turns a notification into a Synthetic row instead of a user bubble.",
      "An independent review of the diff found three confirmed bugs, all fixed: forking from the typed part of a mixed message failed the anchor digest (the remainder is now a render-only prop), an image on a generated-only message was hidden on desktop, and multi-line command output was clamped to two lines with no way to expand on the phone and Android.",
      "CodeRabbit follow-up: only provider transcript text is classified. Android FeedItem.User carries fromTranscript (set for history content with no typed displayBody, persisted in the offline cache), and mobile splits only when displayBody is absent; tests on both surfaces pin that a typed \"[Request interrupted by user] ...\" stays a user bubble. Mobile caches written before synthetic rows are migrated (tests/unit/mobile-thread-history.test.ts).",
      "CodeRabbit follow-up: a user record whose text is context-only but carries images keeps the images with empty text on every path: mobile history (historyToItems) and live (user.message reducer), desktop live (acceptedDesktopUserMessage; MessageBubble splits the context off and renders the images), and Android live (ThreadStoreReducer). Desktop reload and Android history already kept them. Tests: mobile-thread-history, mobile-chat-store, desktop-pending-turn, synthetic-user-row, ThreadStoreReducerTest."
    ],
    "hardware": [],
    "notExercised": [
      "No surface was driven by hand; the rows were checked through unit and component tests only.",
      "Live path: the Claude adapter ignores the SDK's system/task_notification message, so a notification does not appear live on any surface and only appears once the transcript is reloaded. Surfacing it live needs a new runtime event on every client.",
      "Claude's <command-message> slash wrapper is still unwrapped only on desktop; mobile and Android keep showing it as text.",
      "Deferred review finding (existed before this change): a sent turn made only of context blocks is dropped by visibleUserMessageText, so its optimistic bubble never clears its pending state. The context-only list is now longer (system-reminder, skill, caveat), but the case needs a user to paste only such blocks.",
      "Caches written before this change never recorded whether a row's text was typed, so their history user rows (h- ids) are treated as transcript on first launch: mobile migrates them once (persist version 1) and Android decodes them that way. A typed history message that starts with a marker is misread in that offline snapshot until the next history load reseeds it. A React Native cache imported into native Android drops its synthetic rows, since Android has no cached kind for them; the next history load restores them."
    ]
  }
}
